{
  "type": "visual",
  "version": "1.0.0",
  "id": "example-nl",
  "content": {
    "kind": "number-line",
    "components": [
      {
        "id": "nl",
        "type": "number-line",
        "props": { "min": 0, "max": 10, "step": 1, "highlight": [5] }
      }
    ]
  },
  "accessibility": {
    "label": "Number line from 0 to 10",
    "description": "The number 5 is highlighted"
  }
}